{
  "format": "open-mp-ui",
  "version": 1,
  "name": "Inventory",
  "elements": [
    {
      "id": "inventory.background",
      "kind": "rect",
      "x": 120,
      "y": 80,
      "w": 400,
      "h": 240,
      "color": "#172D3BE8"
    },
    {
      "id": "inventory.title",
      "kind": "text",
      "x": 136,
      "y": 96,
      "w": 360,
      "h": 20,
      "text": "Inventory",
      "color": "#EDF3F7FF",
      "font": 1,
      "sx": 0.2,
      "sy": 1.1,
      "outline": 1
    },
    {
      "id": "slot0",
      "kind": "rect",
      "x": 136,
      "y": 132,
      "w": 112,
      "h": 24,
      "color": "#367DA2FF",
      "selectable": true
    },
    {
      "id": "slot0.label",
      "kind": "text",
      "x": 143,
      "y": 137,
      "w": 100,
      "h": 14,
      "text": "Phone",
      "color": "#EDF3F7FF",
      "font": 1,
      "sx": 0.2,
      "sy": 1.1,
      "outline": 1
    },
    {
      "id": "slot1",
      "kind": "rect",
      "x": 258,
      "y": 132,
      "w": 112,
      "h": 24,
      "color": "#367DA2FF",
      "selectable": true
    },
    {
      "id": "slot1.label",
      "kind": "text",
      "x": 265,
      "y": 137,
      "w": 100,
      "h": 14,
      "text": "Water",
      "color": "#EDF3F7FF",
      "font": 1,
      "sx": 0.2,
      "sy": 1.1,
      "outline": 1
    },
    {
      "id": "slot2",
      "kind": "rect",
      "x": 380,
      "y": 132,
      "w": 112,
      "h": 24,
      "color": "#367DA2FF",
      "selectable": true
    },
    {
      "id": "slot2.label",
      "kind": "text",
      "x": 387,
      "y": 137,
      "w": 100,
      "h": 14,
      "text": "Keys",
      "color": "#EDF3F7FF",
      "font": 1,
      "sx": 0.2,
      "sy": 1.1,
      "outline": 1
    },
    {
      "id": "slot3",
      "kind": "rect",
      "x": 136,
      "y": 202,
      "w": 112,
      "h": 24,
      "color": "#367DA2FF",
      "selectable": true
    },
    {
      "id": "slot3.label",
      "kind": "text",
      "x": 143,
      "y": 207,
      "w": 100,
      "h": 14,
      "text": "Map",
      "color": "#EDF3F7FF",
      "font": 1,
      "sx": 0.2,
      "sy": 1.1,
      "outline": 1
    },
    {
      "id": "slot4",
      "kind": "rect",
      "x": 258,
      "y": 202,
      "w": 112,
      "h": 24,
      "color": "#367DA2FF",
      "selectable": true
    },
    {
      "id": "slot4.label",
      "kind": "text",
      "x": 265,
      "y": 207,
      "w": 100,
      "h": 14,
      "text": "Food",
      "color": "#EDF3F7FF",
      "font": 1,
      "sx": 0.2,
      "sy": 1.1,
      "outline": 1
    },
    {
      "id": "slot5",
      "kind": "rect",
      "x": 380,
      "y": 202,
      "w": 112,
      "h": 24,
      "color": "#367DA2FF",
      "selectable": true
    },
    {
      "id": "slot5.label",
      "kind": "text",
      "x": 387,
      "y": 207,
      "w": 100,
      "h": 14,
      "text": "Radio",
      "color": "#EDF3F7FF",
      "font": 1,
      "sx": 0.2,
      "sy": 1.1,
      "outline": 1
    },
    {
      "id": "inventory.close",
      "kind": "rect",
      "x": 394,
      "y": 278,
      "w": 110,
      "h": 24,
      "color": "#367DA2FF",
      "selectable": true
    },
    {
      "id": "inventory.close.label",
      "kind": "text",
      "x": 401,
      "y": 283,
      "w": 98,
      "h": 14,
      "text": "Close",
      "color": "#EDF3F7FF",
      "font": 1,
      "sx": 0.2,
      "sy": 1.1,
      "outline": 1
    }
  ]
}
